
mysql> CREATE TABLE source_table (
    ->     id INT,
    ->     name VARCHAR(50),
    ->     value INT
    -> );
Query OK, 0 rows affected (0.23 sec)

mysql> INSERT INTO source_table (id, name, value) VALUES (1, 'Alice', 100);
Query OK, 1 row affected (0.04 sec)

mysql> INSERT INTO source_table (id, name, value) VALUES (2, 'Bob', 200);
Query OK, 1 row affected (0.01 sec)

mysql> INSERT INTO source_table (id, name, value) VALUES (3, 'Charlie', 300);
Query OK, 1 row affected (0.01 sec)

mysql> CREATE TABLE target_table (
    ->     id INT,
    ->     name VARCHAR(50),
    ->     value INT
    -> );
Query OK, 0 rows affected (0.06 sec)

mysql> INSERT INTO target_table (id, name, value) VALUES (1, 'Alice', 50);
Query OK, 1 row affected (0.02 sec)

mysql> INSERT INTO target_table (id, name, value) VALUES (2, 'Bob', 150);
Query OK, 1 row affected (0.01 sec)

mysql> SELECT *FROM target_table;
+------+-------+-------+
| id   | name  | value |
+------+-------+-------+
|    1 | Alice |    50 |
|    2 | Bob   |   150 |
+------+-------+-------+
2 rows in set (0.01 sec)

mysql> SELECT *FROM source_table;
+------+---------+-------+
| id   | name    | value |
+------+---------+-------+
|    1 | Alice   |   100 |
|    2 | Bob     |   200 |
|    3 | Charlie |   300 |
+------+---------+-------+
3 rows in set (0.00 sec)

mysql> DELIMITER $$
mysql>
mysql> CREATE PROCEDURE merge_data()
    -> BEGIN
    ->     -- Declare the cursor to select data from source_table
    ->     DECLARE done INT DEFAULT FALSE;
    ->     DECLARE src_id INT;
    ->     DECLARE src_name VARCHAR(50);
    ->     DECLARE src_value INT;
    ->
    ->     -- Declare the cursor
    ->     DECLARE cur CURSOR FOR
    ->         SELECT id, name, value FROM source_table;
    ->
    ->     -- Declare the exit handler for the cursor
    ->     DECLARE CONTINUE HANDLER FOR NOT FOUND SET done = TRUE;
    ->
    ->     -- Open the cursor
    ->     OPEN cur;
    ->
    ->     -- Start the loop
    ->     read_loop: LOOP
    ->         -- Fetch data from the cursor
    ->         FETCH cur INTO src_id, src_name, src_value;
    ->
    ->         -- Exit the loop if no more rows to fetch
    ->         IF done THEN
    ->             LEAVE read_loop;
    ->         END IF;
    ->
    ->         -- Merge the data into the target_table
    ->         IF EXISTS (SELECT 1 FROM target_table WHERE id = src_id) THEN

    ->             -- If record exists, update it
    ->             UPDATE target_table SET value = value + src_value WHERE id = src_id;
    ->         ELSE
    ->             -- If record does not exist, insert it
    ->             INSERT INTO target_table (id, name, value) VALUES (src_id, src_name, src_value);
    ->         END IF;
    ->
    ->     END LOOP;
    ->
    ->     -- Close the cursor
    ->     CLOSE cur;
    ->
    -> END$$
Query OK, 0 rows affected (0.06 sec)

mysql>
mysql> DELIMITER ;
mysql>
mysql> SELECT *FROM target_table;
+------+-------+-------+
| id   | name  | value |
+------+-------+-------+
|    1 | Alice |    50 |
|    2 | Bob   |   150 |
+------+-------+-------+
2 rows in set (0.00 sec)

mysql> SELECT *FROM source_table;
+------+---------+-------+
| id   | name    | value |
+------+---------+-------+
|    1 | Alice   |   100 |
|    2 | Bob     |   200 |
|    3 | Charlie |   300 |
+------+---------+-------+
3 rows in set (0.00 sec)

mysql> CALL merge_data();
Query OK, 0 rows affected (0.07 sec)

mysql> SELECT *FROM target_table;
+------+---------+-------+
| id   | name    | value |
+------+---------+-------+
|    1 | Alice   |   150 |
|    2 | Bob     |   350 |
|    3 | Charlie |   300 |
+------+---------+-------+
3 rows in set (0.00 sec)

mysql> SELECT *FROM source_table;
+------+---------+-------+
| id   | name    | value |
+------+---------+-------+
|    1 | Alice   |   100 |
|    2 | Bob     |   200 |
|    3 | Charlie |   300 |
+------+---------+-------+
3 rows in set (0.00 sec)

mysql> INSERT INTO source_table (id, name, value) VALUES (4, 'hello', 250);
Query OK, 1 row affected (0.01 sec)

mysql> SELECT *FROM source_table;
+------+---------+-------+
| id   | name    | value |
+------+---------+-------+
|    1 | Alice   |   100 |
|    2 | Bob     |   200 |
|    3 | Charlie |   300 |
|    4 | hello   |   250 |
+------+---------+-------+
4 rows in set (0.00 sec)

mysql> SELECT *FROM target_table;
+------+---------+-------+
| id   | name    | value |
+------+---------+-------+
|    1 | Alice   |   150 |
|    2 | Bob     |   350 |
|    3 | Charlie |   300 |
+------+---------+-------+
3 rows in set (0.00 sec)

mysql> CALL merge_data();
Query OK, 0 rows affected (0.02 sec)

mysql> SELECT *FROM target_table;
+------+---------+-------+
| id   | name    | value |
+------+---------+-------+
|    1 | Alice   |   250 |
|    2 | Bob     |   550 |
|    3 | Charlie |   600 |
|    4 | hello   |   250 |
+------+---------+-------+
4 rows in set (0.00 sec)

mysql> UPDATE source_table
    -> SET value = 250
    -> WHERE id = 2;
Query OK, 1 row affected (0.01 sec)
Rows matched: 1  Changed: 1  Warnings: 0

mysql> SELECT *FROM source_table;
+------+---------+-------+
| id   | name    | value |
+------+---------+-------+
|    1 | Alice   |   100 |
|    2 | Bob     |   250 |
|    3 | Charlie |   300 |
|    4 | hello   |   250 |
+------+---------+-------+
4 rows in set (0.00 sec)

mysql> SELECT *FROM target_table;
+------+---------+-------+
| id   | name    | value |
+------+---------+-------+
|    1 | Alice   |   250 |
|    2 | Bob     |   550 |
|    3 | Charlie |   600 |
|    4 | hello   |   250 |
+------+---------+-------+
4 rows in set (0.00 sec)

mysql> CALL merge_data();
Query OK, 0 rows affected (0.02 sec)

mysql> SELECT *FROM target_table;
+------+---------+-------+
| id   | name    | value |
+------+---------+-------+
|    1 | Alice   |   350 |
|    2 | Bob     |   800 |
|    3 | Charlie |   900 |
|    4 | hello   |   500 |
+------+---------+-------+
4 rows in set (0.00 sec)

mysql> DELETE FROM source_table WHERE id = 1;
Query OK, 1 row affected (0.01 sec)

mysql> SELECT *FROM source_table;
+------+---------+-------+
| id   | name    | value |
+------+---------+-------+
|    2 | Bob     |   250 |
|    3 | Charlie |   300 |
|    4 | hello   |   250 |
+------+---------+-------+
3 rows in set (0.00 sec)

mysql> CALL merge_data();
Query OK, 0 rows affected (0.02 sec)

mysql> SELECT *FROM target_table;
+------+---------+-------+
| id   | name    | value |
+------+---------+-------+
|    1 | Alice   |   350 |
|    2 | Bob     |  1050 |
|    3 | Charlie |  1200 |
|    4 | hello   |   750 |
+------+---------+-------+
4 rows in set (0.00 sec)

mysql>

























The example you provided demonstrates the use of stored procedures, cursors, and control flow structures in MySQL to perform a merge operation between two tables (source_table and target_table). Here's a breakdown of the related theory:

1. Stored Procedures
A stored procedure is a set of SQL statements that can be saved and reused. It allows you to encapsulate logic and execute complex operations on the database.

In this case, the merge_data stored procedure:

Loops over data from source_table using a cursor.
Merges the data into target_table, either updating an existing record or inserting a new one.
Advantages of Stored Procedures:

Reusability: Once created, you can call the procedure multiple times without rewriting the SQL code.
Security: You can control access to data by allowing users to execute procedures without giving them direct access to underlying tables.
Performance: Stored procedures are compiled once and cached, making them faster for repeated use.
2. Cursors in MySQL
A cursor is a database object used to retrieve a specific row or set of rows from a result set one at a time. In the context of MySQL, cursors are useful when you need to process individual rows sequentially in a procedural way.

In your code:

sql
Copy code
DECLARE cur CURSOR FOR
    SELECT id, name, value FROM source_table;
The cursor iterates over all rows from source_table, and the loop fetches each row individually. This allows you to process each record to decide whether to update or insert it into target_table.

3. Control Flow Structures
Control flow statements allow conditional logic and looping within stored procedures. In your example, two main control structures are used:

LOOP and LEAVE: The loop iterates through each row fetched by the cursor until the done flag is set, after which the loop exits.

sql
Copy code
IF done THEN
    LEAVE read_loop;
END IF;
IF Statement: The procedure checks whether the record exists in target_table. If it does, the value is updated, and if not, a new record is inserted.

sql
Copy code
IF EXISTS (SELECT 1 FROM target_table WHERE id = src_id) THEN
    UPDATE target_table SET value = value + src_value WHERE id = src_id;
ELSE
    INSERT INTO target_table (id, name, value) VALUES (src_id, src_name, src_value);
END IF;
4. MERGE Operations
Although MySQL doesn’t have a built-in MERGE statement like other SQL databases (such as SQL Server or Oracle), the logic to perform a merge can be implemented using IF EXISTS or similar conditional logic to:

Update a row if it exists.
Insert a row if it does not exist.
This procedure essentially performs a manual MERGE operation, updating target_table with data from source_table while preserving records that already exist.

5. Transactional Control
Even though it's not explicitly shown here, in many cases stored procedures are executed within a transaction, ensuring that the changes made are consistent and can be rolled back in case of an error.

In this context, MySQL allows the use of START TRANSACTION, COMMIT, and ROLLBACK to ensure data integrity when executing multiple steps that might depend on each other.

6. Exception Handling
The stored procedure uses an exit handler for cursor operations:

sql
Copy code
DECLARE CONTINUE HANDLER FOR NOT FOUND SET done = TRUE;
This line of code ensures that once all rows have been fetched, the loop can gracefully exit. In general, error and exception handling can be used to manage runtime errors during the procedure execution.

7. Table Updates and Deletions
After each execution of the merge_data procedure, records in target_table are either updated or inserted, as seen in your SQL statements. Additionally, when a row is deleted from source_table, this doesn’t affect target_table unless additional logic is added (such as removing records in target_table when corresponding records are removed from source_table).

Summary:
This example demonstrates how you can:

Use stored procedures to encapsulate database logic.
Utilize cursors to loop through result sets.
Perform conditional updates and inserts using IF EXISTS.
Manage control flow with loops and conditionals in a structured way.
These concepts form the foundation for more complex database operations and optimization strategies in MySQL.






You said:
theory related to cursor
ChatGPT said:
ChatGPT
Cursors are an important aspect of database management systems (DBMS), particularly in procedural SQL environments. They provide a mechanism for managing and processing result sets row by row. Here’s an overview of the theory related to cursors:

1. Definition of a Cursor
A cursor is a database object that allows you to retrieve and manipulate rows returned by a query one at a time. Unlike a regular query that returns a complete result set, a cursor gives you the ability to interact with individual rows sequentially.

2. Types of Cursors
Cursors can be classified into several types based on their characteristics:

Implicit Cursors: Automatically created by the database for SQL statements that return a single row or perform an action (like an INSERT, UPDATE, or DELETE). They are not explicitly declared.

Explicit Cursors: Defined by the user when the need for more control over row-by-row processing arises. They require declaration, opening, fetching, and closing.

3. Cursor Lifecycle
The lifecycle of an explicit cursor generally includes the following steps:

Declaration: Declare the cursor and define the SQL statement to be executed. This statement can return multiple rows.

sql
Copy code
DECLARE cur CURSOR FOR SELECT column1, column2 FROM table_name;
Opening the Cursor: This step executes the SQL query and establishes the result set. It makes the cursor ready for fetching.

sql
Copy code
OPEN cur;
Fetching Rows: Retrieve rows from the cursor one at a time. Each fetch operation moves the cursor to the next row in the result set.

sql
Copy code
FETCH cur INTO variable1, variable2;
Closing the Cursor: After processing is complete, the cursor should be closed to release resources.

sql
Copy code
CLOSE cur;
Deallocation (Optional): In some DBMS, you may also need to explicitly deallocate the cursor.

sql
Copy code
DEALLOCATE cur;
4. Advantages of Using Cursors
Row-by-Row Processing: Cursors allow for detailed operations on individual rows, which is particularly useful for complex business logic that cannot be efficiently performed with set-based operations.

Control: Cursors give you control over the result set, enabling operations like complex calculations, conditional logic, and multi-step processing for each row.

Flexibility: They can handle various types of data processing needs, such as aggregating data, handling user-defined operations, or performing calculations that require the use of previously fetched data.

5. Disadvantages of Using Cursors
Performance Overhead: Cursors can introduce significant performance issues, especially with large datasets, as they process one row at a time rather than utilizing set-based operations.

Resource Intensive: Cursors consume memory and other resources on the database server, which can lead to scalability problems when used extensively.

Complexity: The code can become complex, making maintenance more difficult. It is often more challenging to read and understand cursor-based logic compared to set-based logic.

6. Cursor Attributes
Cursors can have various attributes that determine their behavior:

Sensitivity: Determines whether the cursor reflects changes made to the underlying data (e.g., whether updates are visible).

Scrollable vs. Non-scrollable: Scrollable cursors allow moving both forward and backward through the result set, while non-scrollable cursors only allow forward movement.

Forward-only Cursors: Allow fetching only in a forward direction. They are typically faster and use fewer resources than scrollable cursors.

7. Cursor Error Handling
Using cursors may lead to runtime errors, especially if you attempt to fetch from an empty result set. Proper error handling should be in place, often using exception handling constructs to manage such cases gracefully.

8. Best Practices for Cursors
Use set-based operations whenever possible, as they are generally more efficient.
Use cursors only when you need row-by-row processing.
Close cursors as soon as you're done to free up resources.
Limit the scope of cursors to minimize resource consumption.
Conclusion
Cursors are powerful tools in SQL that enable detailed and controlled data manipulation, but they should be used judiciously due to their potential impact on performance and complexity. Understanding how and when to use cursors effectively is crucial for developing efficient database applications.
